<?xml version="1.0" encoding="UTF-8"?>
<xs:schema xmlns:xs="http://www.w3.org/2001/XMLSchema">

    <xs:element name="store" type="StoreType"/>

    <xs:complexType name="StoreType">
        <xs:sequence>
            <xs:element name="departments" type="DepartmentsType"/>
            <xs:element name="orders" type="OrdersType"/>
        </xs:sequence>
    </xs:complexType>

    <xs:complexType name="DepartmentsType">
        <xs:sequence>
            <xs:element name="department" type="DepartmentType" minOccurs="0" maxOccurs="unbounded"/>
        </xs:sequence>
    </xs:complexType>

    <xs:complexType name="DepartmentType">
        <xs:sequence>
            <xs:element name="name" type="xs:string"/>
            <xs:element name="employees" type="EmployeesType"/>
        </xs:sequence>
        <xs:attribute name="id" type="xs:long" use="required"/>
    </xs:complexType>

    <xs:complexType name="EmployeesType">
        <xs:sequence>
            <xs:element name="employee" type="EmployeeType" minOccurs="0" maxOccurs="unbounded"/>
        </xs:sequence>
    </xs:complexType>

    <xs:complexType name="EmployeeType">
        <xs:sequence>
            <xs:element name="firstName" type="xs:string"/>
            <xs:element name="lastName" type="xs:string"/>
            <xs:element name="details" type="DetailsType"/>
        </xs:sequence>
        <xs:attribute name="id" type="xs:long" use="required"/>
    </xs:complexType>

    <xs:complexType name="DetailsType">
        <xs:sequence>
            <xs:element name="detail" type="DetailType" minOccurs="0" maxOccurs="unbounded"/>
        </xs:sequence>
    </xs:complexType>

    <xs:complexType name="DetailType">
        <xs:sequence>
            <xs:element name="address" type="xs:string"/>
            <xs:element name="phoneNumber" type="xs:string"/>
        </xs:sequence>
        <xs:attribute name="id" type="xs:long" use="required"/>
    </xs:complexType>

    <xs:complexType name="OrdersType">
        <xs:sequence>
            <xs:element name="order" type="OrderType" minOccurs="0" maxOccurs="unbounded"/>
        </xs:sequence>
    </xs:complexType>

    <xs:complexType name="OrderType">
        <xs:sequence>
            <xs:element name="amount" type="xs:double"/>
            <xs:element name="status" type="xs:string"/>
            <xs:element name="startDate" type="xs:dateTime"/>
            <xs:element name="endDate" type="xs:dateTime"/>
            <xs:element name="products" type="ProductsType"/>
        </xs:sequence>
        <xs:attribute name="id" type="xs:long" use="required"/>
    </xs:complexType>

    <xs:complexType name="ProductsType">
        <xs:sequence>
            <xs:element name="product" type="ProductType" minOccurs="0" maxOccurs="unbounded"/>
        </xs:sequence>
    </xs:complexType>

    <xs:complexType name="ProductType">
        <xs:sequence>
            <xs:element name="name" type="xs:string"/>
            <xs:element name="producer" type="xs:string"/>
        </xs:sequence>
        <xs:attribute name="id" type="xs:long" use="required"/>
    </xs:complexType>

</xs:schema>